{
  "schemaVersion": "mobile-workspace/v1",
  "mode": "synthetic-demo",
  "player": {
    "displayName": "Synthetic Player",
    "units": [
      {
        "id": "synthetic-unit",
        "name": "Synthetic unit",
        "rank": 1,
        "xpLevel": 2
      }
    ],
    "resources": {
      "guildRaidTokens": {
        "current": 2,
        "max": 3,
        "nextTokenInSeconds": 0,
        "regenDelayInSeconds": 43200
      },
      "bombTokens": {
        "current": 1,
        "max": 3,
        "nextTokenInSeconds": 0,
        "regenDelayInSeconds": 43200
      }
    },
    "upstreamUpdatedAt": 0
  },
  "raids": [
    {
      "player": "Synthetic Player",
      "boss": "Synthetic boss",
      "damage": 100,
      "tokens": 1,
      "observedAt": 0
    },
    {
      "player": "Synthetic Player",
      "boss": "Synthetic boss",
      "damage": 200,
      "tokens": 1,
      "observedAt": 0
    }
  ]
}
